{
  "$schema": "https://policy-sentinel.invalid/schemas/land-parcel.schema.v1.json",
  "schemaVersion": "1.0.0",
  "parcelId": "parcel:synthetic-parcel-alpha",
  "trustDomain": "synthetic_test_only",
  "deploymentProfile": "private",
  "landStatusTypes": ["county_land", "unknown"],
  "landStatusEvidence": [
    {
      "landStatusType": "county_land",
      "sourceLabel": "Synthetic county land status listing",
      "sourceUrl": "https://county.example.invalid/land-status/synthetic-parcel-alpha",
      "retrievedAt": "2026-08-02T00:00:00Z",
      "sourceUpdatedAt": null,
      "evidenceBasis": "synthetic_fixture",
      "validationState": "validated"
    }
  ],
  "jurisdictionLayers": [
    {
      "level": "federal",
      "authorityName": "Synthetic Federal Union",
      "nationId": null,
      "evidenceUrl": "https://federal.example.invalid/jurisdiction/synthetic-parcel-alpha",
      "evidenceDate": "2026-08-01"
    },
    {
      "level": "county",
      "authorityName": "Example County",
      "nationId": null,
      "evidenceUrl": "https://county.example.invalid/jurisdiction/synthetic-parcel-alpha",
      "evidenceDate": "2026-08-01"
    },
    {
      "level": "tribal",
      "authorityName": "Synthetic Nation A",
      "nationId": "nation:synthetic-a",
      "evidenceUrl": "https://county.example.invalid/jurisdiction/synthetic-parcel-alpha-tribal",
      "evidenceDate": "2026-08-01"
    }
  ],
  "boundaryRef": {
    "boundaryId": "synthetic-boundary-alpha",
    "schemaVersion": "1.0.0"
  },
  "sensitivity": "restricted",
  "nonClaims": [
    "not_a_legal_land_status_determination",
    "not_a_treaty_rights_determination",
    "not_a_jurisdiction_or_applicability_determination",
    "not_a_substitute_for_the_official_cadastral_or_trust_record"
  ]
}
